{
  "schema_version": "daily_snapshot.v1",
  "snapshot_id": "c1d2e3f4-a5b6-4c7d-8e9f-0a1b2c3d4e5f",
  "source": "business-intelligence-system",
  "sim_date": "2018-01-10",
  "pipeline": {
    "data_current": true,
    "last_successful_load_at": "2026-10-10T02:07:31Z"
  },
  "departments": [
    {
      "department": "supply",
      "status": "red",
      "score": 0.72,
      "owner": "person:leitung-logistik",
      "open_insights": 2,
      "kpis": [
        {
          "kpi": "delivery_time_avg_days",
          "value": 27.9,
          "target": 12.0,
          "trend_pct": 41.3,
          "status": "red"
        },
        {
          "kpi": "on_time_rate",
          "value": 0.71,
          "target": 0.9,
          "trend_pct": -14.2,
          "status": "red"
        }
      ]
    },
    {
      "department": "customer",
      "status": "yellow",
      "score": 0.38,
      "owner": "person:leitung-kundenservice",
      "open_insights": 0,
      "kpis": [
        {
          "kpi": "review_score_avg",
          "value": 3.9,
          "target": 4.2,
          "trend_pct": -4.1,
          "status": "yellow"
        }
      ]
    },
    {
      "department": "sales",
      "status": "green",
      "score": 0.05,
      "owner": "person:leitung-vertrieb",
      "open_insights": 0,
      "kpis": [
        {
          "kpi": "gmv",
          "value": 41230.5,
          "target": 38000.0,
          "trend_pct": 6.4,
          "status": "green"
        }
      ]
    },
    {
      "department": "hr",
      "status": "grey",
      "score": null,
      "owner": null,
      "open_insights": 0,
      "kpis": []
    }
  ],
  "open_insight_ids": [
    "6f1c2d5e-0b7a-4c3e-9a1f-2d4b6c8e0a12",
    "0a9b8c7d-6e5f-4a3b-9c2d-1e0f9a8b7c6d"
  ],
  "data_class": "public",
  "created_at": "2026-10-10T02:09:02Z"
}
